topic,demography,sociology,words
123,7.680936230978164e-4,0.0011374360776761302, variables table effects results analysis sample effect model odds significant variable characteristics analyses higher models factors measures greater significantly regression
124,0.00395654710199728,0.026686750149799064, mobility occupational status occupation occupations prestige american mobile stratification structure father origin sociological duncan upward review sociology origins sons patterns
125,0.0032292601760350857,0.0021386184559129243, context role provide strategies factors process resources access including approach potential future influence opportunities individual understanding specific focus support impact
126,6.625668576134621e-4,0.0016567119142269356, hispanic latino mexican hispanics american latinos ethnic spanish ethnicity americans anglo groups acculturation origin minority anglos texas cultural english group
127,4.065723425702435e-4,7.398676457111336e-4, care child children childcare quality mothers arrangements day preschool center age availability mother caring centers family type education formal relative
128,0.004994093563004861,0.004844100615877258, model models effects estimated estimates fit parameters linear parameter estimate observed association latent modeling random intercept error multilevel statistics structural
129,0.01833478350883378,0.0026999102796312416, birth births parity interval months order intervals live conception born childbearing fertility age duration timing spacing month subsequent length period
130,0.0016763015323042728,0.007567946131834665, role relationship relationships roles relations york expectations emotional personal commitment feelings involvement individuals development experience feel conflict press interpersonal eds
131,0.0011156443368362011,0.0038879646839515294, girls woman young man girl boys love mother good boy baby physical don control give told feel body person felt
132,0.011442032911537269,0.012354110728480569, differences age table higher difference effect size effects analysis lower average results significant large found proportion compared similar greater small
133,0.0038267184037937933,0.002704712021836263, cohort cohorts born age effects period generation birth generations baby size relative generational differences boom older world historical younger youngest
134,0.0027960810207217184,0.002390228007875454, puerto rican rico york caribbean ricans cuban island dominican cuba city jamaica cubans haiti haitian west republic mainland haitians miami
135,8.213091851199207e-4,0.011588464779541797, marriage family adjustment marital marriages counseling living life love married mate dating found selection studies problems success courtship persons factors
136,0.011891501864337394,0.008357774476946495, marriage married age marital single marriages status unmarried marry ages older widowed divorced younger aged marrying persons young proportions separated
137,0.0033987356680315454,0.009914532808612543, factor indicators analysis measures measure variables dimensions factors measurement components indicator indices dimension component cluster based scores structure set variable
138,4.1982620163528365e-4,1.5488691569805953e-4, weight age body height obesity growth bmi menarche girls overweight fat twins blood physical stature differences pressure measurements obese human
139,0.0013354001123946906,0.002661673225431512, church religious muslim religion muslims christian churches catholic members islam christians clergy congregations god christianity leaders islamic membership hindus religions
140,4.825709083093667e-4,9.005235708617513e-4, marriage cohabitation cohabiting married relationship family couples nonmarital marital marry living economic unmarried single premarital partner differences relationships partners formation
141,0.0016036004903609816,8.359553871624136e-4, birth infant weight infants prenatal pregnancy low maternal births risk neonatal mothers born factors mother outcomes babies perinatal care pregnant
142,0.0010601821377167404,0.0022681807350728466, mothers mother fathers father maternal involvement parenting child children single daughters paternal motherhood involved sons fatherhood biological absence daughter childrearing
143,0.023636804793149876,0.005037735939277216, fertility demographic decline levels transition low control economic reproductive childbearing tfr demography patterns development review birth differentials children press completed
144,0.0015780617547139788,0.004218311819272183, community communities local residents area place places resident collective neighborhood institutions park environment stability neighboring urbanism attachment sense locally newcomers
145,0.0014700350951062414,0.006481432047740072, class classes middle lower working upper position manual strata stratification workers skilled iii stratum structure unskilled service professionals professional identification
146,0.0021281735751864507,0.004526234796898282, marriage kinship kin sons son daughters father property residence daughter man married mother inheritance marriages relations bride dowry wife brothers
147,0.04923947023621917,0.03829623032495226, people problems problem made part fact make present case large future long point great good situation means question view place
148,0.004529310758559257,0.0022108647376411633, policy state public policies government welfare private institutional federal measures governments institutions reduce regime programs provision incentives regimes legislation effects
149,0.0031397413956645182,0.0063225572180988085, respondents respondent questions reported responses question asked survey perceived response perceptions reasons report majority perception conducted questionnaire half answer answers
150,6.569878044212658e-4,0.0028324292846807894, health mental physical status illness risk conditions problems studies chronic national disease association medicine behavior poor disorders prevalence psychiatric public
151,0.0037299702224701846,0.0012248937271607024, germany german west und polish die east poland germans berlin foreigners federal von republic poles turkish swiss des foreign zur
152,2.1250067641290858e-4,0.0022265283721077957, household housework labor division domestic tasks family traditional relative home roles work share responsibility role egalitarian studies ideology hours sharing
153,0.00046598082499940327,8.624684998367318e-4, siblings sibling family biological older younger stepfamilies sisters order families stepchildren stepfamily brothers stepparent sibship stepfather parents remarriage stepparents parent
154,0.002056497081232557,9.524312970598688e-4, village villages district rural local villagers area town community houses guinea field cash water papua fishing economy collected located communities
155,0.0035864167045552126,0.002634747781350362, scale variables items significant sample differences found results psychology scores table measures analyses related studies reported higher findings analysis factors
156,2.910963735271099e-4,3.7522846007022873e-4, support child custody enforcement amount nonresident payments custodial paternity noncustodial cases pay parents visitation received contact orders financial award awards
157,7.442148568561311e-4,2.612381923285831e-4, korea korean south east north asia asian kim koreans seoul lee china park affairs crisis including system confucian institute republic
158,3.2521234551031477e-4,0.0027109309300821895, political politics trust levels democracy science democratic civic studies citizens participation action interest government institutions collective civil mobilization comparative system
159,0.005928517096521321,0.006824040610852303, political national movement government power politics support leaders party interests nation role early state control position history debate opposition movements
160,0.015224787626276647,0.006996935884559771, census information statistics persons bureau statistical censuses records sources enumeration office classification characteristics published count including definition record demographic file
161,0.0016635201553755394,0.0011746316284296002, program programs control intervention treatment evaluation effects participants experimental impact training interventions group project design education comparison effectiveness baseline effective
162,0.0058737215003075395,0.0018124014240419356, capital demand model economics utility increase consumption human supply function production goods price higher rate effects market effect theory choice
163,3.6697721498151064e-5,9.55773553941849e-5, sex sexual risk hiv aids gay behavior std prevention heterosexual stds reported lesbian behaviors anal transmitted homosexual public infection disease
164,0.028568986989597027,0.011132125054910378, rate rates increase year total birth period million average table higher increased proportion births decline figure natural annual recent low
165,0.002715462884680577,9.925921888979082e-4, australia australian zealand government aboriginal canberra pacific sydney national south melbourne indigenous australians commonwealth department paper western major islands island
166,0.021286073590748,0.0038808926088781466, cit table registration period footnote year total parish figures loc ibid vol made figure parishes part general information registered recorded
167,0.0017950864577691997,0.005327367214361274, students education professional institutions science higher universities student academic faculty graduates degree fields career sciences colleges graduate field teaching scientists
168,0.00495491476918107,1.4153518873342744e-4, iud acceptors rates acceptance months continuation program users table rate year clinic pill pregnancy method insertion planning total month iuds
169,0.00151975525152235,0.001670553335073034, hong kong jewish israel jews israeli greek jerusalem hebrew greece major arabs origin israelis central greeks studies tel albanian kibbutz
170,5.354127448019819e-4,4.8486697577232115e-4, health services reproductive service clients care providers information quality access matters client facilities clinics training public clinic provided staff delivery
171,0.0013908384790834452,0.001992619419726281, war military conflict security relations peace foreign vietnam forces policy international civil armed world army economic defense affairs service soviet
172,0.0017147209382862047,0.00333638858098614, earnings wage wages experience human market differences capital gap returns relative discrimination labor lower studies pay annual worked return higher
173,0.0014380936335197392,0.002097731283746053, generation immigrant assimilation immigrants review portes york press ethnic studies acculturation generations society adaptation enclave patterns immigration rumbaut incorporation sociological
174,0.0017926858955690937,7.439227881399085e-4, arab egypt turkey turkish middle iran east morocco jordan islamic tunisia moroccan lebanon egyptian palestinian sudan iraq cairo kuwait countries
175,0.0037243588399157555,0.001070072314784665, africa african south nigeria kenya studies ghana caldwell west southern country paper major london africans central state ethiopia vol zimbabwe
176,4.773750851810191e-4,0.0018040004302422713, adult kin family support parents grandparents intergenerational living grandchildren assistance coresidence relations extended caregiving provide contact live generations children grandparent
177,8.578538929954695e-4,2.627056780077635e-4, expenditure consumption rural capita round food urban nss prices table estimates price average areas total consumer survey rounds based distribution
178,0.015319034036326,0.0036326801424063563, report committee commission council conference general members international meeting plan special member organization governments session held year president assembly office
179,3.248867458137608e-4,4.191692543618811e-4, infant maternal infants attachment mothers months development behavior child mother interaction behaviors differences developmental interactions early play temperament effects significant
180,5.829777658953082e-4,5.347061684617233e-4, fetal exposure pregnancy development fetus effects prenatal studies syndrome normal brain exposed retardation weeks developmental pregnant found ultrasound risk incidence
181,0.0017568243180442376,7.028293112784647e-4, indian sri india indians pakistan lanka government tamil east bangladesh south lankan ceylon pakistani colombo tamils sinhalese country reservation asian
182,0.0011925685761202823,7.315446299653625e-4, union unions formation behaviour partner partnership family consensual parenthood cohabitation lone couples studies impact higher living eds life couple motherhood
183,1.7728357838530474e-4,1.084532069684405e-4, nepal india government bhutan kathmandu nepali nepalese king indian country relations caste system tibetan hill tamang year terai tibet asian
184,0.0037257532430409112,0.0030961451904296796, history century historical press nineteenth early economic york twentieth late science cambridge great past america england chicago patterns period studies
185,0.006971894929019645,0.016721491629069146, society cultural traditional culture system societies values life modern process western change based norms individual institutions strong world forms systems
186,0.00555365131021797,0.00279356110753144, immigrants immigration immigrant country born native origin foreign recent natives migration international arrival arrived host groups immi skills countries share
187,9.290353707716509e-4,0.001744757157627128, taiwan power authority autonomy decision decisions control taiwanese making mainland influence taipei dominance resources relations independence prc island position status
188,6.091893477427742e-4,0.002309983415762907, job jobs employees employers organizational career employer firms firm management work tenure workplace organizations performance employee temporary turnover positions managers
189,0.008597161967619848,0.0014773672349059543, demographic projections future size growth projection projected populations structure current scenario forecasts assumptions forecast based levels demography net forecasting impact
190,4.5698812397551336e-4,0.001815693997091776, american race african racial americans white intermarriage color interracial asian black ethnic whites mixed native ethnicity multiracial america individuals categories
191,0.0045217239087575675,0.004610303520073236, percent compared total proportion source half percentage table fewer average ten approximately highest note slightly percentages majority shows twenty remainder
192,0.0020670623905445734,0.004123635720510688, school education schools primary educational secondary girls teachers schooling enrollment public boys private pupils teacher grade elementary enrolled attendance quality
193,0.0017150134240228134,0.001211913802282677, rights human moral life protection freedom law civil public justice legal discrimination convention individual principles society equality choice equal individuals
194,0.004566008910109465,0.006336075111422908, age young life early older ages adult younger adults transition patterns adulthood cycle stage earlier experience aged late timing pattern
195,0.01253534682702462,0.007223510249951596, migration migrants move mobility net residence place movement destination migrant internal moves moving moved origin distance patterns opportunities migrate flows
196,0.0034419052590423786,0.0013209267214030675, china chinese government people beijing province provinces system shanghai control press development state local policy survey republic early wang reform
197,0.0014134172251977376,5.739377262981342e-4, sterilization medical physicians patients emergency vasectomy control effects studies clinical side sterilized patient procedure doctors operation physician performed reported tubal
198,0.004351674087423569,0.003546441570233946, costs cost tax expenditures government benefits average total spending income higher public expenditure taxes services price fiscal pay amount budget
199,0.0011745231141808519,0.004656836008693814, college school students graduates degree higher graduate dropout education enrollment dropouts student expectations aspirations graduation colleges plans completion enrolled postsecondary
200,0.003271193474990807,0.0011658388603588562, labour employment workers sector work force wage market industry total working share services table labourers wages source unemployment manufacturing employed
